product_id,product_name,category,discounted_price,actual_price,discount_percentage,rating,rating_count,about_product,product_link
B091TJHWL9,Bean Bag Toss Game for Kids - Cornhole Board Outdoor Toys for Toddlers -Party Activities Carnival Outside Yard Backyard Beach Lawn Games Toy for Kid Boys Girls Age 3 4 5 6 7 8 Year Old Birthday Gifts,Toys_and_Games,23.97,,,4.5,2900,"【2-in-1 Bean Bag Toss Game】: Great designed indoor and outdoor toys for toddlers, this dinosaur theme cornhole tossing game combine 2 gameplay with easier horizontal bean bag toss game and harder vertical darts game. The suitable hole can be thrown into the bean bags, the balls with sticky can be dart accurately. Meeting children to explore variety of game experience! 【Stable Beanbag Board】: The bean bag toss set is made of sturdy and high-quality polyester with a stable base high elastic flat wire. Stable structure can withstand high-impact force. Reinforced edges and corners make sure this set handles some bumps. There are 4 ground nails that can be inserted into the grass fixed, which can stable the corn hole board in the wind outdoors. Suitable for outside yard backyard camping beach lawn games. 【Easy to Assemble & Storage】: Just open the package and take out the corn hole board, then glue the magic stickers on both sides. Easy to carry the bean bag toss toy to the park, yard, beach, back yard, lawn, camp, picnic, playground and so on. Meeting every needs in the portable travel. Great outdoor toys for toddlers age 4-8! 【Fun Challenging Kids Outside Toys】: Bean bag toss outdoor game keep children away from cell phone, TV, computer and other electronic devices, and play outdoors or indoors, where they can set their own game rules to experience beanbag toss or challenging dart game. Greatly develop their creativity and motor skills, bringing joy and laughter to kids and family. 【Great Gifts for Kids Boys Girls】: The core hole toss game is a double-sided play game board with 10 bean bags, 10 sticky balls, 4 ground nails and a manual. Great 3 4 5 6 7 8 9 10 11 12 year old boy and girl birthday gifts, Christmas gifts, beach, yard, lawn, backyard, party or carnival games. keep kids safe, improve number recognition and counting skills while enjoying a happy outdoor games time!",https://www.amazon.com/Bean-Bag-Toss-Game-Kids/dp/B091TJHWL9/ref=sr_1_14?dib=eyJ2IjoiMSJ9.ujuvvKH99aPISQw_8cqXAooZEYFWRPdGDNrF3hbsvcUsWNefZtOLxJcNJs0OtYyAt4R0cB6bmGzcV7TGkxq86CH5yc9ckFg3maa_xeAh9qsm2kn1oX-GwxJpLzEov-F-zdYff0oe_OofyV3_CgKGHfhh1Wsm_Qxwy7Io9LqIrL7c2c6HdZkg_q7i-C7ohCdCIWKTK3OI7FY1vE_noWSld4nIdjwFr7SexIUASdKhbFlcCBIzp1-JHpfuOHpTtj3zidbicrN0OXRpr-mlcdxnEyAJKVFHUiUoQZDULiNJW7g.kZLlG7WVy4f0j25UhSbXLbVsWawg9IHUkIdpnaPYZ3Q&dib_tag=se&keywords=toys+and+games&qid=1746191219&sr=8-14
B00N4OP3OW,"Hasbro Gaming Simon Micro Series Electronic Game for 1 or More Players, Classic Simon Gameplay in a Compact Size, Fun Party Game for Kids Ages 8+",Toys_and_Games,7.9,19.68,59.9,4.5,10746,"COMPACT SIMON GAME UNIT: It's the popular electronic Simon game in a smaller, compact size. It gives players the full gaming experience with all the lights and sounds of the larger size CLASSIC SIMON GAMEPLAY: Watch, Remember, Repeat! This exciting electronic game challenges players to remember the color pattern and repeat it by pressing the colored buttons in the correct order FUN GAME FOR PARTIES: It's a fun game to bring to parties and get-togethers with friends. It's also a fun 1-player game that challenges players to beat their high score ADVANCED GAMEPLAY: The Simon Micro Series game tests players' skills even more than previous versions. At higher levels, multiple lights come on together that players have to press at the same time FUN GAME FOR KIDS AGES 8+: This compact-sized game packs a punch and keeps players on their toes! It makes a great birthday gift or holiday gift for both boys and girls ages 8 and up",https://www.amazon.com/Hasbro-Simon-Micro-Series-Game/dp/B00N4OP3OW/ref=sr_1_15?dib=eyJ2IjoiMSJ9.ujuvvKH99aPISQw_8cqXAooZEYFWRPdGDNrF3hbsvcUsWNefZtOLxJcNJs0OtYyAt4R0cB6bmGzcV7TGkxq86CH5yc9ckFg3maa_xeAh9qsm2kn1oX-GwxJpLzEov-F-zdYff0oe_OofyV3_CgKGHfhh1Wsm_Qxwy7Io9LqIrL7c2c6HdZkg_q7i-C7ohCdCIWKTK3OI7FY1vE_noWSld4nIdjwFr7SexIUASdKhbFlcCBIzp1-JHpfuOHpTtj3zidbicrN0OXRpr-mlcdxnEyAJKVFHUiUoQZDULiNJW7g.kZLlG7WVy4f0j25UhSbXLbVsWawg9IHUkIdpnaPYZ3Q&dib_tag=se&keywords=toys+and+games&qid=1746191219&sr=8-15
B00000DMF5,"Hasbro Gaming Candy Land Kingdom of Sweet Adventures Board Game for Kids, Ages 3 & Up (Amazon Exclusive)",Toys_and_Games,12.99,14.99,13.3,4.8,35155,"CLASSIC BEGINNER GAME: Do you remember playing Candy Land when you were a kid. Introduce new generations to this sweet kids' board game RACE TO THE CASTLE: Players encounter all kinds of ""delicious"" surprises as they move their cute gingerbread man pawn around the path in a race to the castle NO READING REQUIRED TO PLAY: For kids ages 3 and up, Candy Land can be a great game for kids who haven't learned how to read yet GREAT GAME FOR LITTLE ONES: The Candy Land board game features colored cards, sweet destinations, and fun illustrations that kids love",https://www.amazon.com/Hasbro-Gaming-Kingdom-Adventures-Exclusive/dp/B00000DMF5/ref=sr_1_16?dib=eyJ2IjoiMSJ9.ujuvvKH99aPISQw_8cqXAooZEYFWRPdGDNrF3hbsvcUsWNefZtOLxJcNJs0OtYyAt4R0cB6bmGzcV7TGkxq86CH5yc9ckFg3maa_xeAh9qsm2kn1oX-GwxJpLzEov-F-zdYff0oe_OofyV3_CgKGHfhh1Wsm_Qxwy7Io9LqIrL7c2c6HdZkg_q7i-C7ohCdCIWKTK3OI7FY1vE_noWSld4nIdjwFr7SexIUASdKhbFlcCBIzp1-JHpfuOHpTtj3zidbicrN0OXRpr-mlcdxnEyAJKVFHUiUoQZDULiNJW7g.kZLlG7WVy4f0j25UhSbXLbVsWawg9IHUkIdpnaPYZ3Q&dib_tag=se&keywords=toys+and+games&qid=1746191219&sr=8-16
B08V1R43HT,"Animal Bean Bag Toss Game Toy Outdoor Toss Game, Family Party Party Supplies for Kids, Gift for Boys Birthday or Christmas for Toddlers Ages 3 4 5 6 Year Old",Toys_and_Games,25.64,35.99,28.8,4.5,4622,"2 in 1 Bean bag toss game:The set includes 10 beanbags, 10 balls and 4 ground nails.Hole board and the dart board are combined into one, and the two sides can switch back and forth to enjoy different game modes. Safe and durable:Made of high-quality thick fabric, no sharp edge and durable. It does not take up space, an indoor and outdoor tossing game that kids love. Portable and collapsible:Lightweight folding frame, easy to set up and store, easy to carry when traveling. Bean bag toss game keep children away from electronic screens and play anytime, anywhere. Sports exercise toys:This is a great toy for kids.Fun and safe bean bag toss and will help with learning to take turns and get a little exercise.Play with the children and enjoy a great parent-child time. Perfect gift:For holiday or birthday gift choices, kids are excited to receive it.This bean bag toss game will bring the greatest happiness to kids and the whole family.",https://www.amazon.com/Outdoor-Supplies-Birthday-Christmas-Toddlers/dp/B08V1R43HT/ref=sr_1_17?dib=eyJ2IjoiMSJ9.ujuvvKH99aPISQw_8cqXAooZEYFWRPdGDNrF3hbsvcUsWNefZtOLxJcNJs0OtYyAt4R0cB6bmGzcV7TGkxq86CH5yc9ckFg3maa_xeAh9qsm2kn1oX-GwxJpLzEov-F-zdYff0oe_OofyV3_CgKGHfhh1Wsm_Qxwy7Io9LqIrL7c2c6HdZkg_q7i-C7ohCdCIWKTK3OI7FY1vE_noWSld4nIdjwFr7SexIUASdKhbFlcCBIzp1-JHpfuOHpTtj3zidbicrN0OXRpr-mlcdxnEyAJKVFHUiUoQZDULiNJW7g.kZLlG7WVy4f0j25UhSbXLbVsWawg9IHUkIdpnaPYZ3Q&dib_tag=se&keywords=toys+and+games&qid=1746191219&sr=8-17
B07S6FDHPN,"Dinosaur Toys, 252 PCS Create A Dinosaur World Road Race Tracks, Flexible Track Playset, 2pcs Dinosaur Car for 3 4 5 6 Year Old Boys Girls Birthday Party Favor Gift",Toys_and_Games,23.99,29.99,20.0,4.6,21022,"Toy Train Set Tracks: 216 Track Pieces - 4 Tree - 2 Dinosaurs - 2 Dinosaur Cars - 1 X-shape Crossroad - 4 Slopes - 8 Traffic Signs. Dinosaur Themed Race Track - Create unique dinosaur train tracks of dinosaur world. A good interaction toy for boys and girls. Be easy to assemble or take down to store. The train track pieces are dynamic and can twist left or right, which when the entire track is pieced together, allows a lot of flexibility, make a new track layout for different variations. The dinosaur car requires 1x""AA"" battery (NOT INCLUDED) - 2 dinosaur cars and 2 dinosaur molds make the game more interesting more attractive. Learn to cooperate. Exercise hand-eye coordination and color perception. Perfect Present: This train track set come with color packing box - Dinosaur theme - Cars. Safe & Non-toxic, High quality & Durable. No harmful to kids. The best choice for kids B-day gift or Xmas gift.",https://www.amazon.com/Dinosaur-156pcs-Create-Flexible-Playset/dp/B07S6FDHPN/ref=sr_1_18?dib=eyJ2IjoiMSJ9.ujuvvKH99aPISQw_8cqXAooZEYFWRPdGDNrF3hbsvcUsWNefZtOLxJcNJs0OtYyAt4R0cB6bmGzcV7TGkxq86CH5yc9ckFg3maa_xeAh9qsm2kn1oX-GwxJpLzEov-F-zdYff0oe_OofyV3_CgKGHfhh1Wsm_Qxwy7Io9LqIrL7c2c6HdZkg_q7i-C7ohCdCIWKTK3OI7FY1vE_noWSld4nIdjwFr7SexIUASdKhbFlcCBIzp1-JHpfuOHpTtj3zidbicrN0OXRpr-mlcdxnEyAJKVFHUiUoQZDULiNJW7g.kZLlG7WVy4f0j25UhSbXLbVsWawg9IHUkIdpnaPYZ3Q&dib_tag=se&keywords=toys+and+games&qid=1746191219&sr=8-18
B0DC62J1TN,"Kids Smart Phone for Girls, Christmas Birthday Gifts for Girls Age 3-10,Kids Toys Cell Phone, Toddler Learning Play Toy Phone with Dual Camera, Game, Music Player",Toys_and_Games,28.71,,,4.4,918,"Multifunctional Kids Smart Phone:The upgraded touchscreen kids' cell phone comes with various features, including a selfie camera, MP3 player, games, paint, voice recorder, country and daily guide, alarm, flashlight, stopwatch, calculator, theme and screensaver selection, time format, volume control, and more. It offers convenience, fun, and a new experience for kids ages 4-12. Educational Kids Toy:The upgraded kids' toy phone features 26 alphabet lessons, 10 storybook fables, 24 country landmarks, 5 daily activities, and 13 puzzle games to enhance logic, thinking, and reaction skills. With the drawing feature, kids can express themselves artistically anytime, without needing paper or a dedicated drawing area. Habit Tracking: The toddler toy phone includes a built-in flashlight for exploring and a timer for managing time. The habit recorder helps remind children to engage in activities like studying, eating, and exercising, promoting the development of good habits and improving self-discipline and focus. MP3 Music Player and Funny Photo Frames: The kids pretend phones features high-quality speakers for enjoying music without headphones. It includes an SD memory card for downloading MP3 songs, pictures, and videos. Children can take photos with 23 funny frames, capturing happy moments with family and friends. Great Gift for Girls and Boys Ages 3-8:The kids smartphones is small, lightweight, and made from safe materials. It's an ideal gift for birthdays and Christmas for boys and girls aged 3 - 10.",https://www.amazon.com/Christmas-Birthday-Toddler-Learning-Camera/dp/B0DC62J1TN/ref=sr_1_19?dib=eyJ2IjoiMSJ9.ujuvvKH99aPISQw_8cqXAooZEYFWRPdGDNrF3hbsvcUsWNefZtOLxJcNJs0OtYyAt4R0cB6bmGzcV7TGkxq86CH5yc9ckFg3maa_xeAh9qsm2kn1oX-GwxJpLzEov-F-zdYff0oe_OofyV3_CgKGHfhh1Wsm_Qxwy7Io9LqIrL7c2c6HdZkg_q7i-C7ohCdCIWKTK3OI7FY1vE_noWSld4nIdjwFr7SexIUASdKhbFlcCBIzp1-JHpfuOHpTtj3zidbicrN0OXRpr-mlcdxnEyAJKVFHUiUoQZDULiNJW7g.kZLlG7WVy4f0j25UhSbXLbVsWawg9IHUkIdpnaPYZ3Q&dib_tag=se&keywords=toys+and+games&qid=1746191219&sr=8-19
B0D8KW4JPM,TOMY Games Pop Up Bluey Kids Game - Preschool Games and Bluey Toys for Family Game Night - Classic Board Games - Kids Toys for 2-4 Players - Ages 4 Years and Up,Toys_and_Games,17.97,,,4.5,61871,"Let’s Do This: The lovable Blue Healer is back with an exciting twist to the classic Pop Up kids' game! Launch Bluey out of her barrel and see who'll become the champion of Family Game Night Kids and Family Games: Each player takes turns sliding the crocodile sticks into Bluey’s barrel, but pick the wrong slot and…POP! Bluey is out of her barrel and so are you A Real Guessing Game: Pop Up Bluey is a game of thrills and suspense! No one knows which slot will make Bluey pop up next, it changes every time the barrel is reset Easy to Play: With plenty of excitement and quick turn by turn play, this children's game is perfect for family fun and easy for kids to teach their friends to play Great for All Ages: With simple to understand rules and quick gameplay, Bluey brings plenty of fun to your game table; for 2-4 players or teams, ages 4 years and up",https://www.amazon.com/TOMY-Games-Bluey-Kids-Game/dp/B0D8KW4JPM/ref=sr_1_20?dib=eyJ2IjoiMSJ9.ujuvvKH99aPISQw_8cqXAooZEYFWRPdGDNrF3hbsvcUsWNefZtOLxJcNJs0OtYyAt4R0cB6bmGzcV7TGkxq86CH5yc9ckFg3maa_xeAh9qsm2kn1oX-GwxJpLzEov-F-zdYff0oe_OofyV3_CgKGHfhh1Wsm_Qxwy7Io9LqIrL7c2c6HdZkg_q7i-C7ohCdCIWKTK3OI7FY1vE_noWSld4nIdjwFr7SexIUASdKhbFlcCBIzp1-JHpfuOHpTtj3zidbicrN0OXRpr-mlcdxnEyAJKVFHUiUoQZDULiNJW7g.kZLlG7WVy4f0j25UhSbXLbVsWawg9IHUkIdpnaPYZ3Q&dib_tag=se&keywords=toys+and+games&qid=1746191219&sr=8-20
B00004YO0Y,"Let's Go Fishin' Game by Pressman - The Original Fast-Action Fishing Game!, 1-4 players",Toys_and_Games,8.97,14.99,40.2,4.4,9315,"Our Let's Go Fishin' game is the original version of a well-known and well-loved fishing game that parents will remember playing as kids Gameplay helps develop hand-eye coordination Players use mini fishing poles to try to catch the most fish Features a rotating pond and fish that open and close their mouths For 1-4 players, ages 4 and up Try to get the most fish in this classic action packed game Deluxe plastic game base  ",https://www.amazon.com/Pressman-Toys-0055J-Lets-Fishin/dp/B00004YO0Y/ref=sr_1_21?dib=eyJ2IjoiMSJ9.ujuvvKH99aPISQw_8cqXAooZEYFWRPdGDNrF3hbsvcUsWNefZtOLxJcNJs0OtYyAt4R0cB6bmGzcV7TGkxq86CH5yc9ckFg3maa_xeAh9qsm2kn1oX-GwxJpLzEov-F-zdYff0oe_OofyV3_CgKGHfhh1Wsm_Qxwy7Io9LqIrL7c2c6HdZkg_q7i-C7ohCdCIWKTK3OI7FY1vE_noWSld4nIdjwFr7SexIUASdKhbFlcCBIzp1-JHpfuOHpTtj3zidbicrN0OXRpr-mlcdxnEyAJKVFHUiUoQZDULiNJW7g.kZLlG7WVy4f0j25UhSbXLbVsWawg9IHUkIdpnaPYZ3Q&dib_tag=se&keywords=toys+and+games&qid=1746191219&sr=8-21
B07FNQFLJ5,Ayeboovi Toss and Catch Ball Game Outdoor Toys for Kids Yard Games Beach Toys Outside Games for 3 4 5 6 7 8 9 10 Year Old Boys Girls (Upgraded),Toys_and_Games,22.94,,,,4341,"Outdoor Toys for Kids – Enjoy endless fun with this classic 90s toss and catch game which includes 4 paddles, 4 sticky balls and a storage bag, perfect birthdays, Carnival, Back-to-school gift for boys girls aged 3+ at the pool, beach, yard, lawn or playground Built To Last - This toss and catch game set is built with waterproof paddings and stronger stiches. 3 times more durable than competition. Perfect kids toys for 3-8 year old boys and girls outdoor beach pool yard camping games and lawn games or PE classes Boost Kids' Fitness – While having a blast, toddlers kids and adults enhance their hand-eye coordination and motor skills with every throw and catch. A great way to teach the basics of throwing and catching baseball and tennis Tons Of Outdoor Fun - A toss and catch game kids will relish and adults won’t get enough of! The hooh and loop feature makes this game really special. This means less time spent running around trying to catch a loose ball and more time spent having fun with friends and family Perfect Gifts For Kids - Classical 90S catch ball set will be a perfect party favors or birthday gifts for 3 4 5 6 7 8 9 10 11 12 year old boys and girls. Conveniently storage by exquisite gift box and storage bag and enjoy outdoor fun with your kids families or friends wherever you go",https://www.amazon.com/Ayeboovi-Stocking-Stuffers-Birthday-Upgraded/dp/B07FNQFLJ5/ref=sr_1_22?dib=eyJ2IjoiMSJ9.ujuvvKH99aPISQw_8cqXAooZEYFWRPdGDNrF3hbsvcUsWNefZtOLxJcNJs0OtYyAt4R0cB6bmGzcV7TGkxq86CH5yc9ckFg3maa_xeAh9qsm2kn1oX-GwxJpLzEov-F-zdYff0oe_OofyV3_CgKGHfhh1Wsm_Qxwy7Io9LqIrL7c2c6HdZkg_q7i-C7ohCdCIWKTK3OI7FY1vE_noWSld4nIdjwFr7SexIUASdKhbFlcCBIzp1-JHpfuOHpTtj3zidbicrN0OXRpr-mlcdxnEyAJKVFHUiUoQZDULiNJW7g.kZLlG7WVy4f0j25UhSbXLbVsWawg9IHUkIdpnaPYZ3Q&dib_tag=se&keywords=toys+and+games&qid=1746191219&sr=8-22
B0BGWYD9KC,"Rechargeable Game Activity Cube - Toys for Boys and Girls - 9 Fun Brain & Memory Games - Birthday Gifts for Age 6, 7, 8, 9, 10, 11, 12 Year Old Kids Teens - Best Boy Toy Gift Ideas",Toys_and_Games,29.99,,,4.6,2607,"BLAST OFF: Get ready for some epic galactic fun - a thrilling out-of-this-world space race with high-adrenaline challenges! SINGLE / MULTIPLAYER MODES: Play solo or with friends! It offers a collection of one- and two-player games, complete with buzzing, beeping, exciting music, and voice-guided instructions and feedback from Mission Control. Includes the option to adjust the volume or mute it altogether. RECHARGEABLE CUBE: You never have to stop the game to change a few batteries. The flashing cube is fully rechargeable! The set includes a charging cable to charge the Cube effortlessly. EPIC GAMES: ALIEN HUNT - Hunt for the aliens and squash them! TIC TAC GO - Line up 3 colors in a row in this classic game! COSMIC RAYS - For every colored square on the map, find its duplicate on the other faces. ROCKET TRAIL - Listen closely and follow the provided sequence. SPACE COMMAND - Obey Mission Command - just like Simon Says. SHOOTING STAR - Keep the tail of the blue comet short. PLAY WITH SOUND & COLOR: SPACE ROCK - Create your own stellar tunes! Record and play your musical creations. SATELLIGHTS - Light the night with colored blinking disco lights accompanied by pumping dance music! COLOR ECLIPSE - Listen to gentle music as you design your Cube just the way you like it!",https://www.amazon.com/Rechargeable-Game-Activity-Cube-Christmas/dp/B0BGWYD9KC/ref=sr_1_23?dib=eyJ2IjoiMSJ9.ujuvvKH99aPISQw_8cqXAooZEYFWRPdGDNrF3hbsvcUsWNefZtOLxJcNJs0OtYyAt4R0cB6bmGzcV7TGkxq86CH5yc9ckFg3maa_xeAh9qsm2kn1oX-GwxJpLzEov-F-zdYff0oe_OofyV3_CgKGHfhh1Wsm_Qxwy7Io9LqIrL7c2c6HdZkg_q7i-C7ohCdCIWKTK3OI7FY1vE_noWSld4nIdjwFr7SexIUASdKhbFlcCBIzp1-JHpfuOHpTtj3zidbicrN0OXRpr-mlcdxnEyAJKVFHUiUoQZDULiNJW7g.kZLlG7WVy4f0j25UhSbXLbVsWawg9IHUkIdpnaPYZ3Q&dib_tag=se&keywords=toys+and+games&qid=1746191219&sr=8-23
B09N7LSJVP,"16 Bit Handheld Game for Kids Adults, 3.0'' Large Screen Preloaded 230 HD Classic Retro Video Games with USB Rechargeable Battery & 3 Game Cartridges for Birthday Gift for Kids 4-12 (Red)",Toys_and_Games,32.99,,,4.1,1747,"Brand New Game Console: This handheld video games built-in 230 newly designed educational puzzle and leisure, racing, fighting, adventure games without repetition. Also comes with 3 game cartridges, each with a separate classic game. Have fun playing the game console while they work on important developmental skills such as hand-eye coordination, thinking and problem-solving skills Larger and Clearer Screen: 3 inch high definition display and substantially more stable, no longer prone to black screen. To ensure the portability and the comfort of playing the game. Our gameboy is not too bulky or too small, perfectly tailored for children. Warm tip: Please tear off the protective film before use Rechargeable Battery: Our handheld games built-in 800mAh high-capacity lithium battery, which can be charged and played at the same time. After each full charge, the game can be played for 5 hours. When you are on a business trip, travel, camping, you don't have to worry about running out of power. (Note: Please fully charge the battery before the first use Sturdy and Durable: The shell of this handheld game console is made of sturdy and environmentally friendly plastic. Anti-fingerprint and anti-scratch. Tested for a long time and real experience, it is strong enough to withstand daily drops Perfect Gift for Kids & Adults: This retro handheld game systems can definitely bring you and your children a surprise. It is perfect as a gift for birthday, Christmas, party",https://www.amazon.com/TaddToy-Handheld-Preloaded-Rechargeable-Cartridges/dp/B09N7LSJVP/ref=sr_1_24?dib=eyJ2IjoiMSJ9.ujuvvKH99aPISQw_8cqXAooZEYFWRPdGDNrF3hbsvcUsWNefZtOLxJcNJs0OtYyAt4R0cB6bmGzcV7TGkxq86CH5yc9ckFg3maa_xeAh9qsm2kn1oX-GwxJpLzEov-F-zdYff0oe_OofyV3_CgKGHfhh1Wsm_Qxwy7Io9LqIrL7c2c6HdZkg_q7i-C7ohCdCIWKTK3OI7FY1vE_noWSld4nIdjwFr7SexIUASdKhbFlcCBIzp1-JHpfuOHpTtj3zidbicrN0OXRpr-mlcdxnEyAJKVFHUiUoQZDULiNJW7g.kZLlG7WVy4f0j25UhSbXLbVsWawg9IHUkIdpnaPYZ3Q&dib_tag=se&keywords=toys+and+games&qid=1746191219&sr=8-24
B079D7XHSY,"Flipslide Game - Electronic Handheld Game | Addictive Multiplayer Puzzle Game of Skill | Flip, Slide & Match Colors to Beat the Clock | 4 Thrilling Game Modes | Ages 8+ | Includes Batteries",Toys_and_Games,12.99,,,4.6,10011,"Flipslide is an addictive, fast paced puzzle game of skill! Master the moves to beat the blocks – flip to find the colour and slide to match the lights. Challenge yourself or play with friends. The only hard part is putting it down! The fun never ends with four game modes to choose from: Speed Mode, Multiplayer Mode, Level Mode or Memory Mode. For ages 8+ - take anywhere, play it anytime, it’s addictive fun for everyone. Includes 1 x Flipslide console and Instructions. Batteries included.",https://www.amazon.com/Games-25254-Flipslide-Game/dp/B079D7XHSY/ref=sr_1_25?dib=eyJ2IjoiMSJ9.ujuvvKH99aPISQw_8cqXAooZEYFWRPdGDNrF3hbsvcUsWNefZtOLxJcNJs0OtYyAt4R0cB6bmGzcV7TGkxq86CH5yc9ckFg3maa_xeAh9qsm2kn1oX-GwxJpLzEov-F-zdYff0oe_OofyV3_CgKGHfhh1Wsm_Qxwy7Io9LqIrL7c2c6HdZkg_q7i-C7ohCdCIWKTK3OI7FY1vE_noWSld4nIdjwFr7SexIUASdKhbFlcCBIzp1-JHpfuOHpTtj3zidbicrN0OXRpr-mlcdxnEyAJKVFHUiUoQZDULiNJW7g.kZLlG7WVy4f0j25UhSbXLbVsWawg9IHUkIdpnaPYZ3Q&dib_tag=se&keywords=toys+and+games&qid=1746191219&sr=8-25
B0CRSLWS81,"Educational Insights Kanoodle® Ultimate Champion 3D - Brain Teaser Puzzle Game, Featuring 500 Challenges, Gift for Ages 7+",Toys_and_Games,12.69,24.99,49.2,4.7,984,"THE ULTIMATE UPGRADE – Kanoodle has leveled up! With 500 puzzles and a new timer feature, this evolution will test even the most experienced players BEAT THE CLOCK - Race against the built-in timer or challenge friends and family to beat your best time for hours of brain-bending entertainment PERFECT FOR TRAVEL - Compact, self-contained case keeps all pieces secure, ideal for road trips, restaurants, and on-the-go entertainment TIKTOK SENSATION - Join the millions who've taken on the #KanoodleChallenge and play along with your favorite creators' viral videos! CROSS-GENERATIONAL PLAY - Engage the whole family, from the kids to the grandparents, with puzzles to challenge every age THE PERFECT GIFT - Have an upcoming birthday or holiday? Our toys & games make the perfect activity for the home or classroom, no matter the occasion",https://www.amazon.com/Educational-Insights-Kanoodle%C2%AE-Ultimate-Champion/dp/B0CRSLWS81/ref=sr_1_26?dib=eyJ2IjoiMSJ9.ujuvvKH99aPISQw_8cqXAooZEYFWRPdGDNrF3hbsvcUsWNefZtOLxJcNJs0OtYyAt4R0cB6bmGzcV7TGkxq86CH5yc9ckFg3maa_xeAh9qsm2kn1oX-GwxJpLzEov-F-zdYff0oe_OofyV3_CgKGHfhh1Wsm_Qxwy7Io9LqIrL7c2c6HdZkg_q7i-C7ohCdCIWKTK3OI7FY1vE_noWSld4nIdjwFr7SexIUASdKhbFlcCBIzp1-JHpfuOHpTtj3zidbicrN0OXRpr-mlcdxnEyAJKVFHUiUoQZDULiNJW7g.kZLlG7WVy4f0j25UhSbXLbVsWawg9IHUkIdpnaPYZ3Q&dib_tag=se&keywords=toys+and+games&qid=1746191219&sr=8-26
B094XQD7Q3,"3-in-1 Vintage Giant Checkers, Tic, Tac, Toe, with Reversible Mat, 24 Chips, Family Board Game, Lawn Game, BBQ Party Favor, Indoor and Outdoor Activity for Kids and Adults",Toys_and_Games,17.99,,,4.7,1384,"Our outdoor game includes 24 qiant checkers about 2.8"" wide, 12 pieces red, and 12 pieces black. This qiant checkerboard qame includes three classic qames in one! Checkers, tic, tac, toe, and huge tic, tac, toe. Perfect for indoor and outdoor games and activities! Nice to give on birthdays, Easter baskets, Christmas stocking stuffers, and more. Safe for children: Non-toxic, Non-BPA, Meet US toy standards. Safety test approved",https://www.amazon.com/JOYIN-Vintage-Checkers-Reversible-Activity/dp/B094XQD7Q3/ref=sr_1_27?dib=eyJ2IjoiMSJ9.ujuvvKH99aPISQw_8cqXAooZEYFWRPdGDNrF3hbsvcUsWNefZtOLxJcNJs0OtYyAt4R0cB6bmGzcV7TGkxq86CH5yc9ckFg3maa_xeAh9qsm2kn1oX-GwxJpLzEov-F-zdYff0oe_OofyV3_CgKGHfhh1Wsm_Qxwy7Io9LqIrL7c2c6HdZkg_q7i-C7ohCdCIWKTK3OI7FY1vE_noWSld4nIdjwFr7SexIUASdKhbFlcCBIzp1-JHpfuOHpTtj3zidbicrN0OXRpr-mlcdxnEyAJKVFHUiUoQZDULiNJW7g.kZLlG7WVy4f0j25UhSbXLbVsWawg9IHUkIdpnaPYZ3Q&dib_tag=se&keywords=toys+and+games&qid=1746191219&sr=8-27
B01DY818JG,ThinkFun Zingo Bingo Award Winning Preschool Game for Pre-Readers and Early Readers Age 4 and Up - One of the Most Popular Board Games for Boys and Girls and their Parents (97700),Toys_and_Games,21.96,,,4.8,16677,"Skill Level: Beginner Develops Critical Skills – Perfect For Pre-Readers And Early Readers, Builds Language And Matching Skills In Preschool Kids Through Fun, Fast-Paced Play Zingo Is As Popular In The Classroom With Teachers As It Is In The Home With Families What You Get - This Is The Newest Edition Of The World Famous Game Zingo, One Of Thinkfun'S Best Games For Kids Ages 4 And Up, And It Includes An Extra Zingo Card So That Up To 7 Players Can Play! Also Includes A Unique Zinger Device That Delights Players Of All Ages Clear Instructions – Easy To Learn With A Clear, High Quality Instruction Manual You Can Start Playing Right Away",https://www.amazon.com/ThinkFun-Zingo-Winning-Pre-Readers-Readers/dp/B01DY818JG/ref=sr_1_28?dib=eyJ2IjoiMSJ9.ujuvvKH99aPISQw_8cqXAooZEYFWRPdGDNrF3hbsvcUsWNefZtOLxJcNJs0OtYyAt4R0cB6bmGzcV7TGkxq86CH5yc9ckFg3maa_xeAh9qsm2kn1oX-GwxJpLzEov-F-zdYff0oe_OofyV3_CgKGHfhh1Wsm_Qxwy7Io9LqIrL7c2c6HdZkg_q7i-C7ohCdCIWKTK3OI7FY1vE_noWSld4nIdjwFr7SexIUASdKhbFlcCBIzp1-JHpfuOHpTtj3zidbicrN0OXRpr-mlcdxnEyAJKVFHUiUoQZDULiNJW7g.kZLlG7WVy4f0j25UhSbXLbVsWawg9IHUkIdpnaPYZ3Q&dib_tag=se&keywords=toys+and+games&qid=1746191219&sr=8-28
