product_id,product_name,category,discounted_price,actual_price,discount_percentage,rating,rating_count,about_product,product_link
B097F49QYH,"Learning Resources STEM Explorers Brainometry - 34 Pieces, Ages 5+ STEM Toys for Kids, Brain Teaser Toys and Games, Kindergarten Games,Back to School",Toys_and_Games,11.89,14.49,17.9,4.6,1952,"SOLVE the secrets of the shapes! STEM shape puzzles build critical thinking and problem solving skills! TRAIN your brain with tricky sorting and geometry challenges! 10 STEM CHALLENGES included! GIVE THE GIFT OF LEARNING: Whether you’re shopping for holidays, birthdays, or just because, toys from Learning Resources help you discover new learning fun every time you give a gift! Ideal gift for Halloween, Christmas, Stocking Stuffers, Easter Baskets Stuffers or even for Homeschool. Back-to-School Learning Resources Essentials for Students and Teachers: Whether kids are learning to read, studying phonics, or exploring the 123s of early math, our toys and games build learning confidence for preschool, kindergarten, and beyond—they're classroom must-haves!",https://www.amazon.com/Learning-Resources-Explorers-Brainometry-Educational/dp/B097F49QYH/ref=sr_1_50?dib=eyJ2IjoiMSJ9.ujuvvKH99aPISQw_8cqXAooZEYFWRPdGDNrF3hbsvcUsWNefZtOLxJcNJs0OtYyAt4R0cB6bmGzcV7TGkxq86CH5yc9ckFg3maa_xeAh9qsm2kn1oX-GwxJpLzEov-F-zdYff0oe_OofyV3_CgKGHfhh1Wsm_Qxwy7Io9LqIrL7c2c6HdZkg_q7i-C7ohCdCIWKTK3OI7FY1vE_noWSld4nIdjwFr7SexIUASdKhbFlcCBIzp1-JHpfuOHpTtj3zidbicrN0OXRpr-mlcdxnEyAJKVFHUiUoQZDULiNJW7g.kZLlG7WVy4f0j25UhSbXLbVsWawg9IHUkIdpnaPYZ3Q&dib_tag=se&keywords=toys+and+games&qid=1746191219&sr=8-50
B00K8ANYZU,"GoSports Slammo Game Set (Includes 3 Balls, Carrying Case and Rules) - Outdoor Lawn, Beach & Tailgating Roundnet Game for Kids, Teens & Adults",Toys_and_Games,39.99,,,4.4,9460,"WHAT IS SLAMMO: Slammo is an action-packed 2-on-2 volleyball style game where teams have 3 hits to return or spike the ball to the circular net; Fun for the whole family at the beach, BBQs, camping, and in the backyard COMPLETE SET: Includes 1 Slammo roundnet target, 1 large 12 cm training ball to learn the game, 2 smaller 9 cm competition balls, travel carrying case and game rules EASY TO LEARN FOR KIDS & ADULTS: Slammo is the must-have outdoor lawn and beach game for the summer that will engage players of all ages; Retail packaged, makes a great gift WHY CHOOSE SLAMMO: Premium construction at a great value without the inflated price tag; Features high tension netting for optimized bounce, track hook technology for 100% net coverage, and all-surface legs to play anywhere; Designed in the US EASY ASSEMBLY: Imagine the action-packed play style of volleyball but without the hassle of setting up; Quickly jump straight into the game where everyone will be spiking like a pro in no time",https://www.amazon.com/GoSports-Slammo-Balls-Carrying-Rules/dp/B00K8ANYZU/ref=sr_1_51?dib=eyJ2IjoiMSJ9.ujuvvKH99aPISQw_8cqXAooZEYFWRPdGDNrF3hbsvcUsWNefZtOLxJcNJs0OtYyAt4R0cB6bmGzcV7TGkxq86CH5yc9ckFg3maa_xeAh9qsm2kn1oX-GwxJpLzEov-F-zdYff0oe_OofyV3_CgKGHfhh1Wsm_Qxwy7Io9LqIrL7c2c6HdZkg_q7i-C7ohCdCIWKTK3OI7FY1vE_noWSld4nIdjwFr7SexIUASdKhbFlcCBIzp1-JHpfuOHpTtj3zidbicrN0OXRpr-mlcdxnEyAJKVFHUiUoQZDULiNJW7g.kZLlG7WVy4f0j25UhSbXLbVsWawg9IHUkIdpnaPYZ3Q&dib_tag=se&keywords=toys+and+games&qid=1746191219&sr=8-51
B0BVFMWMVP,"60 PCS Magnetic Building Tiles Kids Toys STEM Magnetic Blocks Sensory Toys Kids Games Magnet Building Toy for Boys and Girls Aged 3+, Kids Brain Development Preschool Kindergarten Toddler Toy",Toys_and_Games,22.99,,,4.8,1899,"【Super Value Upgrade Set】 Newly upgraded 3D blocks of Coodoo tiles encourage and stimulate kids' creativity. The set contains 60 pcs rainbow bricks in various shapes, Unique the 6 balconies & 2 awning pieces that fit over the hollow square tiles, perfect for building castles, mansions, food trucks, or wherever else the imagination leads. A fun new option in the world of tile play! 【 Safe & Convenient 】 Magnetic building toys are crafted with premium-grade plastic for durability and resilience, allowing kids to engage in hours of uninterrupted play and building. Plus, the set comes with a convenient storage bag for easy organization and transportation, whether it's taking the tiles outdoors or to a different room. 【 STEM Montessori & Sensory Toys 】 Coodoo magnetic tiles come in a variety of colors and shapes, making them a fun and engaging STEM toy for kids. Building with magnetic tiles not only helps with hand-eye coordination but also enhances cognitive and sensory development, allowing kids to unleash their inner architects and create unique structures. 【 Great Fidgets for Classroom 】Coodoo magnetic tiles are the perfect tool for building, creating, and learning. A must-have for any preschool or kindergarten classroom, teachers and parents alike love these tiles as they keep little hands busy and enhance motor skills. They also work as a great fidget toys for classrooms, providing a rich tactile and sensory experience for kids. 【 Great as Gifts 】 Perfect gift for kids on special occasions like birthdays, Christmas, and graduations – this gift is sure to be a hit with kids of all ages! So why wait? Give your kids the gift of education and entertainment with our magnetic tiles today!",https://www.amazon.com/Magnetic-Building-Development-Preschool-Kindergarten/dp/B0BVFMWMVP/ref=sr_1_52?dib=eyJ2IjoiMSJ9.ujuvvKH99aPISQw_8cqXAooZEYFWRPdGDNrF3hbsvcUsWNefZtOLxJcNJs0OtYyAt4R0cB6bmGzcV7TGkxq86CH5yc9ckFg3maa_xeAh9qsm2kn1oX-GwxJpLzEov-F-zdYff0oe_OofyV3_CgKGHfhh1Wsm_Qxwy7Io9LqIrL7c2c6HdZkg_q7i-C7ohCdCIWKTK3OI7FY1vE_noWSld4nIdjwFr7SexIUASdKhbFlcCBIzp1-JHpfuOHpTtj3zidbicrN0OXRpr-mlcdxnEyAJKVFHUiUoQZDULiNJW7g.kZLlG7WVy4f0j25UhSbXLbVsWawg9IHUkIdpnaPYZ3Q&dib_tag=se&keywords=toys+and+games&qid=1746191219&sr=8-52
B0CMYQNMYW,"B. Toys – Balance Beam for Kids – Interlocking Balancing Beams – 5 Sensory Pads & 8 Beams – Active Play for Toddlers, Kids – 3 Years + – Balance & Build Set",Toys_and_Games,29.99,,,4.7,714,Balance Beams: Get creative and active with a modular set of balancing beams that connect any which way Easy Assembly: Match up the pieces to form beams and connect to the foot pads with a click. Endless Combinations: Build it your way with 8 beam sections and 5 sensory step-stones. Active Play: Playing with this balance beam set helps improve coordination and turns playtime into full-body fun Age: This balancing beam set is recommended for kids 3 years +,https://www.amazon.com/B-toys-Interlocking-Balancing-Toddlers/dp/B0CMYQNMYW/ref=sr_1_53?dib=eyJ2IjoiMSJ9.ujuvvKH99aPISQw_8cqXAooZEYFWRPdGDNrF3hbsvcUsWNefZtOLxJcNJs0OtYyAt4R0cB6bmGzcV7TGkxq86CH5yc9ckFg3maa_xeAh9qsm2kn1oX-GwxJpLzEov-F-zdYff0oe_OofyV3_CgKGHfhh1Wsm_Qxwy7Io9LqIrL7c2c6HdZkg_q7i-C7ohCdCIWKTK3OI7FY1vE_noWSld4nIdjwFr7SexIUASdKhbFlcCBIzp1-JHpfuOHpTtj3zidbicrN0OXRpr-mlcdxnEyAJKVFHUiUoQZDULiNJW7g.kZLlG7WVy4f0j25UhSbXLbVsWawg9IHUkIdpnaPYZ3Q&dib_tag=se&keywords=toys+and+games&qid=1746191219&sr=8-53
B0DPMD7MJR,"Upgraded Kids Toy Golf Set with Dinosaur Automatic Golf Returner, Led Light Up Night Golf Balls, 3 Clubs, Putting Mat, 3-8 Toddler Mini Golf Games, Indoor Outdoor Sports Toys for Boys Girls",Toys_and_Games,32.99,,,4.6,55,"【Swing, Score, Smile】Get your little golfer ready for 9-hole and 18-hole games with the TERRAMUS kids toy golf club set. While golf is a game of skill, it should also be a source of fun for children. Our kids' golf toy set are not only educational, teaching them the basics of the game, but also engaging, ensuring they always have a blast. Let's turn golfing practice into a beloved pastime! 【Exclusive LED Automatic Ball Returner】The classic golf fun comes next level with TERRAMUS exclusive patented auto ball returner. Once kids hit the golf ball into the dinosaur's mouth, look out! The dinosaur will toss the ball back to them for more interactive putting fun. NOTE: 2 X AA batteries Needed (Not Included). 【NEW Upgraded Stronger Toy Clubs】Constructed to engage playful kids and withstand their harshest treament, we upgraded the clubs with thicker and stronger material. Each toddler golf clubs features length adjustable function, ensuring a custom fit for kids aged 2~7. Let the mini golf players practise and perfect that perfect SWING with TERRAMUS toy golf set. 【Glow In The Dark】Keep the fun going at night with the included 2 glow-in-the-dark golf balls and light up golf returner. Just hit the led golf ball and it flashing up on impact, kids will love the colorful arc it makes as it flies through the air, and it's easy to find where it lands. 【16PCS Rich Accessories】This Toy golf ball sets for kids includes everything kids need to start learning the game, including Auto golf ball returner*1, Golf Putting Mat*1, Length Adjustable Golf Clubs*3, Lighting Golf Balls*2, Green Golf Balls*2, Black Golf Balls*2, Golf Tees*2, Golf Targets*2, Sticker*1. With kids golf toy sets' easy set-up, kids will be playing within minutes.",https://www.amazon.com/TERRAMUS-Upgraded-Dinosaur-Automatic-Returner/dp/B0DPMD7MJR/ref=sr_1_54?dib=eyJ2IjoiMSJ9.ujuvvKH99aPISQw_8cqXAooZEYFWRPdGDNrF3hbsvcUsWNefZtOLxJcNJs0OtYyAt4R0cB6bmGzcV7TGkxq86CH5yc9ckFg3maa_xeAh9qsm2kn1oX-GwxJpLzEov-F-zdYff0oe_OofyV3_CgKGHfhh1Wsm_Qxwy7Io9LqIrL7c2c6HdZkg_q7i-C7ohCdCIWKTK3OI7FY1vE_noWSld4nIdjwFr7SexIUASdKhbFlcCBIzp1-JHpfuOHpTtj3zidbicrN0OXRpr-mlcdxnEyAJKVFHUiUoQZDULiNJW7g.kZLlG7WVy4f0j25UhSbXLbVsWawg9IHUkIdpnaPYZ3Q&dib_tag=se&keywords=toys+and+games&qid=1746191219&sr=8-54
B0DDWT2S5P,"BaLaM Hover Soccer Ball Toys for 3-8 Year Old Kids Toddler Boys Girls, Christmas Birthday Gifts for Kids Age 4-6 5-7 8-12, Indoor Rechargable Light-up Toys Games",Toys_and_Games,19.99,,,4.5,154,"[Rechargeable & Eco-Friendly] Ditch the hassle of disposable batteries! BaLaM hover soccer ball features a built-in rechargeable battery, allowing for hours of uninterrupted play on a single charge. Simply plug it in via type C, recharge, —enjoy sustainable, worry-free fun every time. [Innovative Hover Design] No matter the weather, experience the thrill of air soccer at home! This hover ball floats smoothly on any hard surface—whether wood, tiles, or concrete—turning any room into an instant soccer field. [Unique Indoor Soccer Toy for Kids] Searching for a standout gift? This soccer hover ball for kids is the perfect choice for Christmas, birthdays, Easter or any celebration. Lightweight and easy to play with, it's sure to bring joy to boys and girls aged 4-6 5-7 8-12. [Fun & Safe] Our indoor soccer ball features a soft foam bumper that not only protects your furniture from bumps and scratches but also children from injury when playing. Once when it collides with an object, it will quickly bounce off. Perfect for barefoot play or with shoes on. [Unique Christmas Version Color Design] The light up soccer ball features built-in multi-colored LED lights that create a stunning visual effect in the dark, adding an extra layer of excitement to soccer games.",https://www.amazon.com/BaLaM-Christmas-Birthday-Rechargable-Light-up/dp/B0DDWT2S5P/ref=sr_1_55?dib=eyJ2IjoiMSJ9.ujuvvKH99aPISQw_8cqXAooZEYFWRPdGDNrF3hbsvcUsWNefZtOLxJcNJs0OtYyAt4R0cB6bmGzcV7TGkxq86CH5yc9ckFg3maa_xeAh9qsm2kn1oX-GwxJpLzEov-F-zdYff0oe_OofyV3_CgKGHfhh1Wsm_Qxwy7Io9LqIrL7c2c6HdZkg_q7i-C7ohCdCIWKTK3OI7FY1vE_noWSld4nIdjwFr7SexIUASdKhbFlcCBIzp1-JHpfuOHpTtj3zidbicrN0OXRpr-mlcdxnEyAJKVFHUiUoQZDULiNJW7g.kZLlG7WVy4f0j25UhSbXLbVsWawg9IHUkIdpnaPYZ3Q&dib_tag=se&keywords=toys+and+games&qid=1746191219&sr=8-55
B0149MC426,"Mattel Games Magic 8 Ball Kids Toy, Retro Themed Novelty Fortune Teller, Ask a Question and Turn Over for Answer",Toys_and_Games,10.79,,,4.5,14780,"Magic 8 Ball Retro has all the answers to all your deepest questions! This “throwback” version Magic 8 Ball reminds fans of the fortune-telling fun they know and love. After “asking the ball” a yes or no question, turn the toy upside-down and wait for your answer to be revealed through the window. Answers range from positive (“It is certain”) to negative (“Don’t count on it”) to neutral (“Ask again later”). It’s the fastest way to seek advice! Includes 1 Magic 8 Ball novelty toy",https://www.amazon.com/Themed-Novelty-Fortune-Question-Exclusive/dp/B0149MC426/ref=sr_1_56?dib=eyJ2IjoiMSJ9.ujuvvKH99aPISQw_8cqXAooZEYFWRPdGDNrF3hbsvcUsWNefZtOLxJcNJs0OtYyAt4R0cB6bmGzcV7TGkxq86CH5yc9ckFg3maa_xeAh9qsm2kn1oX-GwxJpLzEov-F-zdYff0oe_OofyV3_CgKGHfhh1Wsm_Qxwy7Io9LqIrL7c2c6HdZkg_q7i-C7ohCdCIWKTK3OI7FY1vE_noWSld4nIdjwFr7SexIUASdKhbFlcCBIzp1-JHpfuOHpTtj3zidbicrN0OXRpr-mlcdxnEyAJKVFHUiUoQZDULiNJW7g.kZLlG7WVy4f0j25UhSbXLbVsWawg9IHUkIdpnaPYZ3Q&dib_tag=se&keywords=toys+and+games&qid=1746191219&sr=8-56
B087M4DGD9,"KMUYSL Learning Toys for 2 3 4 5 6 Years Old Boys and Girls - See & Spell CVC Word Builders with Alphabet Cards for Kids, Preschool Learning Activities Toys, Idea Birthday Gifts for Age 2-4 4-6 Kids",Toys_and_Games,12.99,,,4.6,5537,"Wood 80Pcs of See & Spell Learning Toys:This set develops sight-reading vocabulary, spelling, and fine motor skills, color sorting, letter recognition, word association, building sights words, and matching; it’s an easy and exciting toy that multiple children can play with at once, helping them develop important social skills. Contains 28 double sided flash cards + 52 wooden blocks. Help Kids Learn Alphabet: We pay more attention to refined design. With 56 rich scenes and 56 most commonly used Cvc sight words, help children develop memory and brain thinking by establishing connections. There is nothing better than learning thru play. Easy Store & Carry: The spelling game comes with a cute storage bag, easy to store and carry out. Kids can open their gaming devices or store them at any time. The compact packaging structure and light weight make it more convenient to hold. Place them in school bags and suitcases, suitable for many occasions, airplanes, cars, restaurants, etc. Provide a great opportunity to play, interact and communicate with your family, share and help each other. High Quality Material: Smooth edge and surface of wood block, and color of the surface is made of environmentally friendly paint. Absolutely safety for children.Larger-size wooden blocks can prevent the risk of suffocation of children. Parents can rest assured that children complete the entire game system independently. They can easily build their confidence,includes improve children's letter recognition, spelling, word formation, and help early vocabulary recognition accumulation. Absolutely Kids Gift: See and spell stem toy is a Multisensory Learning System! Ideal party favor and various festivals (Easter, Christmas, Halloween candy bags, Thanksgiving, New Year, children's party handouts or rewards). Suitable toys for 2 3 4 5 6 years old boys and girls.",https://www.amazon.com/KMUYSL-Matching-Letter-Spelling-Words/dp/B087M4DGD9/ref=sr_1_53?dib=eyJ2IjoiMSJ9.f0xNgc95YY04dhBGiWEN1kg0w5I7ngHoI2LDaov-eyE4dctOREK1TQHoexptSqKD8bPMdnlbB5CljKouggoA__KWQwgvW8UCTuFiZc0p33HpoyF8G3PXjy_Ail4pMMySx6P7FZ5M-FrhGG3dneGQDrjyd9tdAYEof_-bLW0462YaqoktWx_Mv_pfwNFC6tN8QCIo6RVVCrJT5Nm7hFA3PBTZSwwTS3fo_LsYjQJSsbj9TInAgnUEC8OcWkRcKI4ZF_ranZCJ4d8yaU5ph8TQe3cPWd18-TFFq3sXsFUM1gA.tLUFzBlSn-qBvku_ZpeV2v-E1s6AXZWe1_Y4jkYAPJY&dib_tag=se&keywords=toys+and+games&qid=1746191235&sr=8-53&xpid=fmynyof7IVeA8
B08HMHWXWG,ZMLM Scratch Paper Art-Crafts Gift: 2 Pack Rainbow Notebooks Supplies Toys Easter Basket Stuffers for 3 4 5 6 7 8 9 10 Years Old Girls and Boys Kids Birthday Party Games (Pink),Toys_and_Games,9.99,,,4.7,9005,"1.Awesome Educational Rainbow Art Notebook Set: This art craft notebook is perfect for art lover. Good art supplies for your toddlers to practice drawing and make some simlpe Easter gift card or bookmark; Using this rainbow art book, no ink & non toxic, kids can drawing easily, no worries about ink ending up on the house and carpets. 2.Safe & Fun Art Gifts for Kids: Our magic scratch off notebook is made of thick paper, no paint, non-toxic, non-polluting, and won't harmful for kid's; An ideal educational toy for girls & boys learning to draw. Perfect travel toys art activities gifts for 3 4 5 6 year old girls boys. 3.A Fun & Magic Easter Gift for Boys Girls: Our raibow art craft book set made of premiun paper that safe, no ink & non toxic, safe for kids! Our art set can be easily cleaned and durable to use. Keep bringing endless joy to your children. Perfect gift for birthday, art party, Valentines Day, Easter, Christmas and another hand made-themed party activity game. 4.Promote Parent-child Relationship: Rainbow art notebook not only to promote educational development, improves kid’s motor skills and boosts their imagination into treasured arts. But also Enhance the interaction activities between children and parents, bring a good fun childhood time. 5.Educational Drawing Art Toys Gift: Kids draw as they please, which can not only enhance the imagination of the brain, but also exercise the children's hand-eye coordination and color perception. It's also a communication link between parents and children, sharing their thoughts and love by drawing together!",https://www.amazon.com/ZMLM-Scratch-Paper-Art-Crafts-Notebook-Halloween/dp/B08HMHWXWG/ref=sr_1_79?dib=eyJ2IjoiMSJ9.f0xNgc95YY04dhBGiWEN1kg0w5I7ngHoI2LDaov-eyE4dctOREK1TQHoexptSqKD8bPMdnlbB5CljKouggoA__KWQwgvW8UCTuFiZc0p33HpoyF8G3PXjy_Ail4pMMySx6P7FZ5M-FrhGG3dneGQDrjyd9tdAYEof_-bLW0462YaqoktWx_Mv_pfwNFC6tN8QCIo6RVVCrJT5Nm7hFA3PBTZSwwTS3fo_LsYjQJSsbj9TInAgnUEC8OcWkRcKI4ZF_ranZCJ4d8yaU5ph8TQe3cPWd18-TFFq3sXsFUM1gA.tLUFzBlSn-qBvku_ZpeV2v-E1s6AXZWe1_Y4jkYAPJY&dib_tag=se&keywords=toys+and+games&qid=1746191235&sr=8-79&xpid=fmynyof7IVeA8
B0DRVMSQDB,"Magnetic Blocks, Magnetic Tiles Building Blocks, Magnet Cubes Toddler Kids Toys, Sensory STEM Toys for 3-5 4-6 5-7 6-8 Year Old Boys Girls Easter Birthday Gifts Travel Outdoor Kids Games (0.8IN/2CM)",Toys_and_Games,35.99,,,4.6,82,"MAGNETIC BUILDING BLOCKS - The 100-piece (0.8x0.8x0.8IN) magnetic blocks set features dual themes: forest and mine. It contains 25 carefully designed elements, suitable for boys and girls aged 3 and up. Children can use their imagination to freely build their own worlds, enhancing their patience, concentration, and motor skills. TOYS & GAMES - While playing with these toys, children can immerse themselves in various roles. Through this open-ended play, they can experience adventures that transition from reality to virtuality, as well as the unique shift from 2D to 3D gameplay. These toys are highly recommended, especially for children aged 3 to 8. EDUCATIONAL LEARNING TOYS - Our magnetic toys are not just for fun; they also serve as valuable STEM Montessori educational tools. Through our building toys, children can learn about magnetism and structures, improving their spatial thinking, inventiveness, and creativity. KIDS GAMES SHOWTIME - ORZbb TOYS is dedicated to developing engaging toys. This building block set allows children to create their own worlds anytime and anywhere. It is suitable for various occasions, such as indoor classrooms, outdoor travel, children's parties, and parent-child games. HIGH-QUALITY KIDS GIFTS - The magnetic cubes are made of high-quality ABS plastic, featuring rounded and sealed edges for a stable structure. They are the perfect size for easy picking up and building, ensuring safety for hands. Suitable for birthdays, Easter, back-to-school season, Christmas gifts for boys and girls aged 3 4 5 6 7 8.",https://www.amazon.com/Magnetic-Building-Toddler-Sensory-Birthday/dp/B0DRVMSQDB/ref=sr_1_139?dib=eyJ2IjoiMSJ9.KHoCz6dgvN6hc5hxXlVruQTcVrxhuYFK9WcnMuJIRzTEl38-A1xZSCGKIqGfIhH-drphltcYv5q-0xt3qOQdFlVaFBmpVp_outAiRaJ-plUSynSdjaC4KZhcqEK5YnsspsO_XZxjiFMV6jzwZ9QIjdjd9n4C2dPdE0T3jIEqabGRB3KmA5RgTMB9pfHiAazdGN-ZE7olVxnLyR6xUM2Tlxr5epvcFsAa_QRnUGbZRgzM9r1WConsDMjA8czZOIt6zmend8SJWV7gBt4UmXqDxnskz76sOLd4akHO_9FXiDQ.MaQtfELCblVtmGxkinW5GDXlGZEWfuo_gJtNFxzcVPc&dib_tag=se&keywords=toys+and+games&qid=1746192565&sr=8-139&xpid=fmynyof7IVeA8
B06Y1N3PTX,Hasbro Gaming Battleship with Planes Strategy Board Game for Ages 7 and Up (Amazon Exclusive),Toys_and_Games,16.99,20.32,16.4,4.7,20851,"A TWIST ON CLASSIC BATTLESHIP GAME: This Amazon Exclusive Battleship with Planes board game features airplanes in addition to ships for awesome strategic gameplay and epic battles SINK SHIPS AND CRASH PLANES: With this strategy naval combat game, fans of the Battleship game can crash enemy planes in addition to sinking ships to win PORTABLE GAME WITH STORAGE: This Battleship game includes 2 portable battle cases and convenient ship, plane, and peg storage. It's an ideal travel game for kids—dive into an instant game on the go A CHILDHOOD FAVORITE: Remember playing the Battleship strategy game as a kid? Enjoy playing this 2 player board game with a new generation GREAT FOR FAMILY GAME NIGHT: Looking for fun indoor games for game night? This strategy board game for kids is a great choice FUN GIFTS FOR KIDS AND ADULTS: Kids board games make great gifts for 7 year old boys and girls and up",https://www.amazon.com/Battleship-Planes-Strategy-Amazon-Exclusive/dp/B06Y1N3PTX/ref=sr_1_169?dib=eyJ2IjoiMSJ9.i7XUog2_AI5vPPbKT38EAZnO9cp6X9iqP4fQw4b76v3k14Vthtc0ngoWh0ZH9mqu9CK--lhbgThjl7nlKvTZp0Og0x_dNkrD1aEqljopcxDeMuc3i2SJIqSqh1vEHMiYuxVezKBhe-ekhvznVvGxXshfcpDz9Qo55unkZ4ydk9AYmts5OUiYbzbG5tSoxUU35OqiFmNBoVtkkt07LUWnCcikRBZvoWPwIN0c1erfMYrjocbvVIRnyv5vRuOQDSwFpgc68oF-BZrIALrc0N1spEJlqqNf-hBi2MFOP3E9vow.DopTDQeQgsAfdTV5aneT2H8JpmVjua0z0xfeoe0U12g&dib_tag=se&keywords=toys+and+games&qid=1746192582&sr=8-169&xpid=fmynyof7IVeA8
B09LY1LNGJ,Magnetic Tiles Toddler Toys Magnetic Building Blocks for Kids Ages 3-12 STEM Educational Toys for Girls & Boys Sensory Play for Preschool Learning,Toys_and_Games,16.99,,,4.8,4324,"【MEANINGFUL TOYS FOR TODDLER KIDS】 The magnetic tiles set helps toddlers to recognize colors, number graphing, build patterns, and shape puzzles. A building toy for kids ages 4-5 to build houses, animals, and simple addition sentences. Science toys for kids ages 6-8, magnetic principles, gravity, and structure 【SMALL CASTLE KIT FOR BEGINNERS】 Our easy-to-handle magnetic tiles are completely safe for kids to enjoy, 32pcs magnetic tiles kit for beginners who want to have a try for the first time, and every piece is designed with very standard size make it compatible with major brands in markets 【GROWS UP WITH KIDS & OPEN-ENDED PLAY】 We can play all kinds of games with magnetic blocks, puzzles, shadow games, find words, dollhouses, etc. STEM-approved magnetic blocks inspire hours of instruction-free playtime while helping children develop math, science, spatial, and tactile skills 【HOME ENTERAINMENT】 A great way to enhance your child's development in a STEM-based learning approach whilst having fun. Not only it will be a great time for your child away from their screen time but it's also a fun way to create memorable family bonding 【KIDS CHRITMAS GIFTS & OUTDOOR TOYS】 Magnet building blocks are suitable for any festivals and occasions, like birthdays, Christmas, Easter, Preschool, Day Care Centers, and so on. The kid toys are packaged in a beautifully designed box, the right gift for kids ages 3-5 4-8. Kids will definitely fall in love with our magnet toy",https://www.amazon.com/Toys-Boys-Toddler-Encourage-Creativity/dp/B09LY1LNGJ/ref=sr_1_181?dib=eyJ2IjoiMSJ9.i7XUog2_AI5vPPbKT38EAZnO9cp6X9iqP4fQw4b76v3k14Vthtc0ngoWh0ZH9mqu9CK--lhbgThjl7nlKvTZp0Og0x_dNkrD1aEqljopcxDeMuc3i2SJIqSqh1vEHMiYuxVezKBhe-ekhvznVvGxXshfcpDz9Qo55unkZ4ydk9AYmts5OUiYbzbG5tSoxUU35OqiFmNBoVtkkt07LUWnCcikRBZvoWPwIN0c1erfMYrjocbvVIRnyv5vRuOQDSwFpgc68oF-BZrIALrc0N1spEJlqqNf-hBi2MFOP3E9vow.DopTDQeQgsAfdTV5aneT2H8JpmVjua0z0xfeoe0U12g&dib_tag=se&keywords=toys+and+games&qid=1746192582&sr=8-181&xpid=fmynyof7IVeA8
B0DJY3JCQS,Magnetic Building Tiles 68 PCS Magnets Stacking Kids Toys STEM Sensory Games Educational Construction Toys Christmas Toy Gift for Boys and Girls 3 4 5 6 7 8 9+Year Old,Toys_and_Games,21.99,,,4.8,175,"ENDLESS BUILDING FUN – This 68-piece magnetic building tiles playset features a distinctive diamond-shaped surface, perfect for sparking creativity and promoting cognitive development in children LEARN THROUGH PLAY – Introduce STEM learning early with these magnetic tiles. They help with visual learning, color recognition, fine motor skills, understanding geometric shapes, magnetic polarity, and basic math. From counting to 3D design, these tiles keep kids engaged in fun and educational activities, giving parents some quiet time INSPIRE CREATIVITY – Boost brain development and unleash imagination with this educational toy set. Ideal for preschoolers and school-age children, these magnetic tiles encourage hand-eye coordination, problem-solving, and teamwork. Great for solo play or group activities in classrooms or kindergartens SAFE & DURABLE – Made from BPA-free ABS plastic with stronger magnets sealed inside, this ASTM-approved set is safe for kids. The bright, high-transparency tiles feature rounded edges to prevent scratches FAMILY BONDING – These tiles provide hours of educational fun while helping kids focus and develop key skills like color matching, construction, sorting, and stacking. Perfect Gift: Ideal for birthdays, holidays, or any occasion, BBMVP magnetic tiles are a gift that offers endless hours of educational entertainment",https://www.amazon.com/BBMVP-Magnetic-Educational-Construction-Christmas/dp/B0DJY3JCQS/ref=sr_1_190?dib=eyJ2IjoiMSJ9.i7XUog2_AI5vPPbKT38EAZnO9cp6X9iqP4fQw4b76v3k14Vthtc0ngoWh0ZH9mqu9CK--lhbgThjl7nlKvTZp0Og0x_dNkrD1aEqljopcxDeMuc3i2SJIqSqh1vEHMiYuxVezKBhe-ekhvznVvGxXshfcpDz9Qo55unkZ4ydk9AYmts5OUiYbzbG5tSoxUU35OqiFmNBoVtkkt07LUWnCcikRBZvoWPwIN0c1erfMYrjocbvVIRnyv5vRuOQDSwFpgc68oF-BZrIALrc0N1spEJlqqNf-hBi2MFOP3E9vow.DopTDQeQgsAfdTV5aneT2H8JpmVjua0z0xfeoe0U12g&dib_tag=se&keywords=toys+and+games&qid=1746192582&sr=8-190&xpid=fmynyof7IVeA8
