product_id,product_name,category,discounted_price,actual_price,discount_percentage,rating,rating_count,about_product,product_link
B09D42RZWX,"Hasbro Gaming Trouble: Bluey Edition Board Game for Kids, 2-4 Players, Race Bluey, Bingo, Bandit, or Chilli to The Finish, Ages 5 and Up (Amazon Exclusive)",Toys_and_Games,16.97,,,4.6,2850,"Bluey-Inspired Fun: Dive into the world of Bluey with this Trouble board game, combining classic gameplay with beloved characters like Bluey, Bingo, Bandit, and Chilli Interactive Gameplay: Roll the die with the iconic Pop-O-Matic bubble and navigate through spaces that encourage interaction and help you advance on your backyard adventure Race to the Finish: Be the first to get all 4 of your character pegs to the Finish Zone, but watch out for Double Trouble and Warp spaces that add exciting twists to your gameplay Easy Setup and Play: This family-friendly board game is quick to set up and features simple rules, making it perfect for kids aged 5 and up to enjoy with their family and friends Durable and Portable: Crafted with high-quality plastic, this Trouble Bluey Edition game is built to last and easy to take along on family game nights or on-the-go fun",https://www.amazon.com/Trouble-Players-Bandit-Chilli-Exclusive/dp/B09D42RZWX/ref=sr_1_31?dib=eyJ2IjoiMSJ9.ujuvvKH99aPISQw_8cqXAooZEYFWRPdGDNrF3hbsvcUsWNefZtOLxJcNJs0OtYyAt4R0cB6bmGzcV7TGkxq86CH5yc9ckFg3maa_xeAh9qsm2kn1oX-GwxJpLzEov-F-zdYff0oe_OofyV3_CgKGHfhh1Wsm_Qxwy7Io9LqIrL7c2c6HdZkg_q7i-C7ohCdCIWKTK3OI7FY1vE_noWSld4nIdjwFr7SexIUASdKhbFlcCBIzp1-JHpfuOHpTtj3zidbicrN0OXRpr-mlcdxnEyAJKVFHUiUoQZDULiNJW7g.kZLlG7WVy4f0j25UhSbXLbVsWawg9IHUkIdpnaPYZ3Q&dib_tag=se&keywords=toys+and+games&qid=1746191219&sr=8-31
B0B6ZH2F5F,SOPPYCID Reusable Magnetic Water Balloons：16 Pack Refillable Water Bomb Splash Balls Self Sealing Quick Fill - Latex-Free Silicone Water Toys for Kids Adults - Water Games Outside Beach Pool Party,Toys_and_Games,42.99,,,4.6,1865,"🌊 【REUSABLE MAGNETIC WATER BALLOONS】- Our reusable water balls are designed with magnetic suction, unlike traditional water balloons that can only be used once, each of our water balloons can be reused at least 1000 times under normal circumstances, which can help you save a lot of money. 🌊 【QUICK FILLING & SELF SEALIN】- Open the water balloons and put it into the water, it will quick fill with water and self sealing. It only takes a few seconds to close then you can throw it directly. Does not need a faucet. Just Enjoy the happy summer time. 🌊 【SUPER SOFT AND SAFE MATERIAL】- The new summer water waterfall ball toy adopts environmentally friendly latex-free silicone material, non-toxic and odor-free, polished smooth, reliable, safe and soft. Parents don't have to worry about their children being injured and latex allergy. 🌊 【EASY TO CLEAN AND STORE】- Still worry about picking up tons of balloon pieces? Disposable waterball is in a mess after pool games, which is difficult to clean. Our refillable water balloon is easy to pick up and convenient to clean up. Equipped with a sturdy mesh bag to keep the water balls in order and dry. 🌊 【FUN SUMMER PARTY TOY】- Start summer fun by playing with water balls. Summer Quick Fill Water Balloon are great for pool toys, beach games, beach supplies and accessories, beach toys, summer toys for outdoor games and activities, water polo fighting games on lawns, pools, beaches and backyards. Suitable for many occasions. Outdoor development, travel and play, children's play, parent-child activities, etc. 🌊 【BEST GIFT FOR KIDS】- Water fight ball water balloons are the perfect prize for kids party favors, themed birthday parties, summer themed party little toy gifts, pool party favors, outdoor games activities for boys girls age 4 5 6 7 8 9 10 11 12, teens and adults. A fun way to keep kids cool and active during the hot days of summer. Just let children enjoy more outdoor sports, play less video games. 🌊 【MULTI-COLOR FOR WATER BALLS】- You will get 16 reusable water balls, 6 colors (white, blue, green, yellow, red and pink); sufficient quantity to meet your daily life pool play needs. Each water balloon toy is about 2.65in in diameter, small and cute; each weighs about 17 grams, lightweight and portable.",https://www.amazon.com/Reusable-Balloons-Smasiagon-Refillable-Latex-Free/dp/B0B6ZH2F5F/ref=sr_1_32?dib=eyJ2IjoiMSJ9.ujuvvKH99aPISQw_8cqXAooZEYFWRPdGDNrF3hbsvcUsWNefZtOLxJcNJs0OtYyAt4R0cB6bmGzcV7TGkxq86CH5yc9ckFg3maa_xeAh9qsm2kn1oX-GwxJpLzEov-F-zdYff0oe_OofyV3_CgKGHfhh1Wsm_Qxwy7Io9LqIrL7c2c6HdZkg_q7i-C7ohCdCIWKTK3OI7FY1vE_noWSld4nIdjwFr7SexIUASdKhbFlcCBIzp1-JHpfuOHpTtj3zidbicrN0OXRpr-mlcdxnEyAJKVFHUiUoQZDULiNJW7g.kZLlG7WVy4f0j25UhSbXLbVsWawg9IHUkIdpnaPYZ3Q&dib_tag=se&keywords=toys+and+games&qid=1746191219&sr=8-32
B0C3QX5ZSX,"Laser Tag Set of 2, Lazer Tag Game for Kids Indoor & Outdoor Play, Gift Ideas for Kids Teens and Adults, Cool Toys for Teenage Ages 8 9 10 11 12+Year Old Boy & Girls",Toys_and_Games,32.99,,,4.5,910,"Cyberpunk Design: Our laser tag gun with vest features a stunning cyberpunk-inspired design that is sure to turn heads and immerse players in an exciting sci-fi gaming experience. Life Indicator Show on Gun & Vest: Laser Tag Gun Set includes 2 guns and 2 vests. 2 teams can fight with a LED display to see the lives and team data. There are two Way for Gameplay,Gun VS Gun Battle & Gun Vest Battle.Gun and Vest all can choose team clolor,and the team color determined by vest.4 teams to choose from. You can choose favorite mode for fierce and exciting battles. Synced Gun and Vest for Ultimate Gaming Experience: The gun and vest are synced, allowing players to accurately track their health and ammo levels on both the gun and vest. This ensures a seamless and immersive gaming experience with realistic feedback during gameplay. Impressive 150ft Shooting Range: Our Infrared laser tag gun boasts an impressive shooting range of 150ft, allowing players to engage in thrilling long-distance battles and test their marksmanship skills. Dual-Sided Lighting for Added Style: The laser tag gun features dual-sided lighting, adding a cool and unique visual element to the gameplay. The dazzling lights on both sides of the gun make it stand out. Also is perfect gift for 8 9 10 11 12 13 14+ year old boys girls and adults.",https://www.amazon.com/Tag-Indoor-Outdoor-Adults-Teenage/dp/B0C3QX5ZSX/ref=sr_1_33?dib=eyJ2IjoiMSJ9.ujuvvKH99aPISQw_8cqXAooZEYFWRPdGDNrF3hbsvcUsWNefZtOLxJcNJs0OtYyAt4R0cB6bmGzcV7TGkxq86CH5yc9ckFg3maa_xeAh9qsm2kn1oX-GwxJpLzEov-F-zdYff0oe_OofyV3_CgKGHfhh1Wsm_Qxwy7Io9LqIrL7c2c6HdZkg_q7i-C7ohCdCIWKTK3OI7FY1vE_noWSld4nIdjwFr7SexIUASdKhbFlcCBIzp1-JHpfuOHpTtj3zidbicrN0OXRpr-mlcdxnEyAJKVFHUiUoQZDULiNJW7g.kZLlG7WVy4f0j25UhSbXLbVsWawg9IHUkIdpnaPYZ3Q&dib_tag=se&keywords=toys+and+games&qid=1746191219&sr=8-33
B07P5X2F4X,"DINOBROS Dinosaur Toy Pull Back Cars,6 Pack Dino Toys for 3 Year Old Boys Girls and Toddlers,Boy Toys Age 3,4,5 and Up,Pull Back Toy Cars,Dinosaur Games with T-Rex",Toys_and_Games,9.99,15.99,37.5,4.7,29559,"[6-PACK DINOSAUR CARS] A collection of 6 artfully-crafted roadster dinosaur pull back toy cars make perfect dino toys for 3 year old boys. Our dinosaur toys include T-Rex, Triceratops, Stegosaurus, Ankylosaur, Pterosaur, and Velociraptor. [PERFECT MINI SIZE] Small Size Dinosaur Pull Back Toy Cars are approximately 5"" in length. This size makes the dinos toys for toddlers and boys easy to hold and play with the dinosaur cars. Recommended toys for boys ages 3, 4, and 5. [PULL BACK TOY CARS] The simple pull back and go dinosaur cars are easy to play, go fast and sturdy. These dino toys for 3-year-olds and up, teach children about different dinosaurs. Just pull it back and watch the dino cars race in the room. [GREAT TOYS FOR BOYS & TODDLERS] Dinosaur cars make a great party favor or a winning prize at a dinosaur themed birthday party. The dino pull back toy cars make for fun dino games. Our dino cars can help a child learn about dinosaurs. [DINOSAUR TOYS] The 6 distinct dinosaur cars designed as a roadster pull back car toy make great toys for boys or girls. The dino toys make a great birthday gift or a special toy to give to any child who loves dinosaurs.",https://www.amazon.com/GreenKidz-Dinosaur-Roadster-Toddlers-Velociraptor/dp/B07P5X2F4X/ref=sr_1_34?dib=eyJ2IjoiMSJ9.ujuvvKH99aPISQw_8cqXAooZEYFWRPdGDNrF3hbsvcUsWNefZtOLxJcNJs0OtYyAt4R0cB6bmGzcV7TGkxq86CH5yc9ckFg3maa_xeAh9qsm2kn1oX-GwxJpLzEov-F-zdYff0oe_OofyV3_CgKGHfhh1Wsm_Qxwy7Io9LqIrL7c2c6HdZkg_q7i-C7ohCdCIWKTK3OI7FY1vE_noWSld4nIdjwFr7SexIUASdKhbFlcCBIzp1-JHpfuOHpTtj3zidbicrN0OXRpr-mlcdxnEyAJKVFHUiUoQZDULiNJW7g.kZLlG7WVy4f0j25UhSbXLbVsWawg9IHUkIdpnaPYZ3Q&dib_tag=se&keywords=toys+and+games&qid=1746191219&sr=8-34
B07YNKKGRJ,Hasbro Gaming Simon Handheld Electronic Memory Game With Lights and Sounds for Kids Ages 8 and Up,Toys_and_Games,19.28,,,4.7,22989,"REPEAT THE PATTERNS: It's the exciting electronic game of lights and sounds; Players repeat random sequences of flashing lights by pressing the colored pads in the correct order SUSPENSE BUILDS: It starts off at a nice steady pace, but the light sequences get more and more complicated as the game continues PLAY SOLO: Play the Simon game with friends or play solo; Try to hit a new high score by completing the longest sequence possible without messing up CLASSIC SIMON GAMEPLAY: Watch, remember, and repeat; The electronic handheld Simon game presents an exciting challenge to repeat the patterns and advance to higher levels",https://www.amazon.com/Electronic-Memory-Handheld-Classic-Gameplay/dp/B07YNKKGRJ/ref=sr_1_39?dib=eyJ2IjoiMSJ9.ujuvvKH99aPISQw_8cqXAooZEYFWRPdGDNrF3hbsvcUsWNefZtOLxJcNJs0OtYyAt4R0cB6bmGzcV7TGkxq86CH5yc9ckFg3maa_xeAh9qsm2kn1oX-GwxJpLzEov-F-zdYff0oe_OofyV3_CgKGHfhh1Wsm_Qxwy7Io9LqIrL7c2c6HdZkg_q7i-C7ohCdCIWKTK3OI7FY1vE_noWSld4nIdjwFr7SexIUASdKhbFlcCBIzp1-JHpfuOHpTtj3zidbicrN0OXRpr-mlcdxnEyAJKVFHUiUoQZDULiNJW7g.kZLlG7WVy4f0j25UhSbXLbVsWawg9IHUkIdpnaPYZ3Q&dib_tag=se&keywords=toys+and+games&qid=1746191219&sr=8-39
B0D94VG7H3,Hungry Hungry Hippos: Teenage Mutant Ninja Turtles Edition Game | Ages 4 and Up | 2 to 4 Players | Kids Board Games | Gifts for Preschoolers (Amazon Exclusive),Toys_and_Games,24.99,,,,0,"THE TEENAGE MUTANT NINJA TURTLES EDITION: Battle for pizza supremacy in the Hungry Hungry Hippos: Teenage Mutant Ninja Turtles Edition board game! Team up with a Turtle to kick butt and chomp the most pepperoni 4 FAVORITE TURTLES: In this totally rad kids game, the Turtles replace hippos. Choose from Donatello, Michelangelo, Leonardo, and Raphael GOBBLE UP THE MOST PEPPERONI TO WIN: Kids launch the marbles, then try to make their Turtle chomp the most pepperoni (red marbles) to win! The bodacious bonus pineapple (yellow marble) is worth 2 marbles BUILD AN EPIC PIZZA WITH THEMED STICKERS: Use the included stickers of pizza crust and toppings to decorate the game’s base and make it look like the ultimate pizza ACTIVE GAME FOR PRESCHOOLERS: This easy to play board game for kids is a fun preschool game for Family Game Night, playdates, and more. The marble storage case makes it a great portable game for on-the-go play too REOLAD MARBLES WITH NINJA-LIKE SPEED: For nonstop action, the chomped marbles instantly reload in the Turtles’ trough—ready to be launched in the next game! Play again and again FUN GIFT FOR TEENAGE MUTANT NINJA TURTLE FANS: Teenage Mutant Ninja Turtles toys and games rule! They make cool holiday and birthday gifts for boys, girls, and kids ages 6 and up",https://www.amazon.com/Hungry-Hippos-Teenage-Preschoolers-Exclusive/dp/B0D94VG7H3/ref=sr_1_40?dib=eyJ2IjoiMSJ9.ujuvvKH99aPISQw_8cqXAooZEYFWRPdGDNrF3hbsvcUsWNefZtOLxJcNJs0OtYyAt4R0cB6bmGzcV7TGkxq86CH5yc9ckFg3maa_xeAh9qsm2kn1oX-GwxJpLzEov-F-zdYff0oe_OofyV3_CgKGHfhh1Wsm_Qxwy7Io9LqIrL7c2c6HdZkg_q7i-C7ohCdCIWKTK3OI7FY1vE_noWSld4nIdjwFr7SexIUASdKhbFlcCBIzp1-JHpfuOHpTtj3zidbicrN0OXRpr-mlcdxnEyAJKVFHUiUoQZDULiNJW7g.kZLlG7WVy4f0j25UhSbXLbVsWawg9IHUkIdpnaPYZ3Q&dib_tag=se&keywords=toys+and+games&qid=1746191219&sr=8-40
B0CJBS6QBD,"Claw Machine for Kids, Mini Vending Machine Girls Unicorn Toys, Candy Grabber Prize Dispenser with Sound & 20 Mini Plush Toys, Electronic Arcade Game Indoor Toy for Home Party Birthday Gifts",Toys_and_Games,39.99,,,4.1,727,"EXCITING GAMEPLAY - Indulge in endless family fun and friendly competition with our Unicorn Claw Machine! Watch your child's eyes light up with excitement as they control the claw, aiming to grab adorable prizes. It's a thrilling experience that keeps kids engaged for hours of fun WHIMSICAL UNICORN DESIGN - This candy grabber claw machine combines classic arcade fun with vibrant colors and a charming unicorn motif, creating an instant attraction for kids who love all things magical. Featuring cheerful carnival music and a 60-second time limit, creating a lively atmosphere and adding challenge to the game SKILL AND PRECISION - Exercise children's hand-eye coordination as they learn to master the art of maneuvering the claw. Every successful grab is a triumph, boosting their confidence and sense of achievement. Encourages problem-solving skills, patience, concentration, and strategic thinking VARIETY OF PRIZES - This kid's mini claw machine comes with 20 random mini plushies. You can fill the machine with whatever prizes you like, such as small toys, trinkets, wrapped candies, snacks, or small treats. Imagine the excitement as kids try to grab their favorite treats, making each game not only fun but also rewarding SAFE & EASY TO USE - Designed with smooth edges and durable materials to withstand enthusiastic play, suitable for kids of all ages. To get started, turn the switch ON, then move the joystick 360° to catch the selected prize. Say goodbye to dead battery with the flexibility of USB and battery options. Whether at home or on-the-go, the fun never stops PERFECT FOR PARTIES AND EVENTS - Make birthdays, playdates, and family gatherings extra special with the mini vending machine. The excitement of playing, the joy of winning, and the laughter shared with friends and family become cherished moments your child will fondly remember. Great gift for kids ages 3 4 5 6 7 8 years old",https://www.amazon.com/Machine-Vending-Dispenser-Electronic-Birthday/dp/B0CJBS6QBD/ref=sr_1_41?dib=eyJ2IjoiMSJ9.ujuvvKH99aPISQw_8cqXAooZEYFWRPdGDNrF3hbsvcUsWNefZtOLxJcNJs0OtYyAt4R0cB6bmGzcV7TGkxq86CH5yc9ckFg3maa_xeAh9qsm2kn1oX-GwxJpLzEov-F-zdYff0oe_OofyV3_CgKGHfhh1Wsm_Qxwy7Io9LqIrL7c2c6HdZkg_q7i-C7ohCdCIWKTK3OI7FY1vE_noWSld4nIdjwFr7SexIUASdKhbFlcCBIzp1-JHpfuOHpTtj3zidbicrN0OXRpr-mlcdxnEyAJKVFHUiUoQZDULiNJW7g.kZLlG7WVy4f0j25UhSbXLbVsWawg9IHUkIdpnaPYZ3Q&dib_tag=se&keywords=toys+and+games&qid=1746191219&sr=8-41
B00IUAAK2A,ThinkFun Gravity Maze,Toys_and_Games,24.71,,,4.6,33015,"Trusted by Families Worldwide - With over 50 million sold, ThinkFun is the world's leading manufacturer of brain games and mind challenging puzzles Develops critical skills – Playing your way through the challenges builds spatial reasoning and planning skills, and is partly an engineering and building toy that provides a great stealth learning experience for young players What you get – Gravity Maze is a combination logic game, marble run, and STEM toy that's one of the best gifts you can buy for boys and girls age 8 and up It contains 60 challenges from beginner to expert, a game grid, 9 towers, 1 target piece, and 3 marbles Clear instructions – Easy to learn with a clear, high quality instruction manual You can start playing and solving right away",https://www.amazon.com/ThinkFun-Gravity-Marble-Logic-Girls/dp/B00IUAAK2A/ref=sr_1_42?dib=eyJ2IjoiMSJ9.ujuvvKH99aPISQw_8cqXAooZEYFWRPdGDNrF3hbsvcUsWNefZtOLxJcNJs0OtYyAt4R0cB6bmGzcV7TGkxq86CH5yc9ckFg3maa_xeAh9qsm2kn1oX-GwxJpLzEov-F-zdYff0oe_OofyV3_CgKGHfhh1Wsm_Qxwy7Io9LqIrL7c2c6HdZkg_q7i-C7ohCdCIWKTK3OI7FY1vE_noWSld4nIdjwFr7SexIUASdKhbFlcCBIzp1-JHpfuOHpTtj3zidbicrN0OXRpr-mlcdxnEyAJKVFHUiUoQZDULiNJW7g.kZLlG7WVy4f0j25UhSbXLbVsWawg9IHUkIdpnaPYZ3Q&dib_tag=se&keywords=toys+and+games&qid=1746191219&sr=8-42
B0CSFPL6JN,"HEX BOTS Wall Crawler Gecko, Rechargeable Remote Control Robot Kids Toys, Climbs up Walls for Prank Toys & Games, RC Robot Toys for Boys & Girls Ages 4 & Up",Toys_and_Games,24.97,29.99,16.7,4.4,1373,"WALL CRAWLING MOVEMENT: Watch the creepy-crawly motion of the Wallcrawler robot toy as it crawls across the floor and climbs up walls, just like a real gecko Scare your family and friends with the life like movement FULL FUNCTION REMOTE: Easy-to-use remote control allows for intuitive play as users can control up to 25 ft (8 m) and move in all directions REALISTIC DESIGN: This light up toy come with LED eyes that can be seen in the dark, green silicone tail and limbs, and a black plastic body, for a realistic, fun design sure to creep your friends out USB BATTERY: 1 USB cable for charging your Gecko is included so you can have endless fun with this HEX BOTS crawling toy 2 AAA batteries required for remote (not included) ROBOTIC KIDS TOYS & GAMES: These robot toys and toys for boys age 4-6 are a fantastic addition to any collection and sure to be a top wish list gift Unleash mechanical mayhem with HEX BOTS Includes: 1 HEX BOTS Wall Crawler Gecko, 1 Remote Control, 1 Charging Cable, 1 Instruction Guide Covered by the Spin Master Care Commitment. See below for full details",https://www.amazon.com/HEX-BOTS-Crawler-Rechargeable-Control/dp/B0CSFPL6JN/ref=sr_1_45?dib=eyJ2IjoiMSJ9.ujuvvKH99aPISQw_8cqXAooZEYFWRPdGDNrF3hbsvcUsWNefZtOLxJcNJs0OtYyAt4R0cB6bmGzcV7TGkxq86CH5yc9ckFg3maa_xeAh9qsm2kn1oX-GwxJpLzEov-F-zdYff0oe_OofyV3_CgKGHfhh1Wsm_Qxwy7Io9LqIrL7c2c6HdZkg_q7i-C7ohCdCIWKTK3OI7FY1vE_noWSld4nIdjwFr7SexIUASdKhbFlcCBIzp1-JHpfuOHpTtj3zidbicrN0OXRpr-mlcdxnEyAJKVFHUiUoQZDULiNJW7g.kZLlG7WVy4f0j25UhSbXLbVsWawg9IHUkIdpnaPYZ3Q&dib_tag=se&keywords=toys+and+games&qid=1746191219&sr=8-45
B07DGYX438,The Original The Floor is Lava! Game by Endless Games - Interactive Game For Kids And Adults - Promotes Physical Activity - Indoor And Outdoor Safe,Toys_and_Games,16.97,,,4.6,15658,"ENDLESS GAMES PRESENTS: The Floor is Lava! is a family board game that promotes physical activity, an active imagination, and engaging excitement for kids and adults. ACTIVE FUN: Turn every floor into an exciting “lava jumping” adventure with The Floor is Lava! Get your child up off the couch or away from video games with this fun interactive game! EVERYONE LEAP: Real entertainment and laugh out loud fun challenges the whole family. Popular for birthdays, holiday parties, or game night. For 2 or more players ages 5 -105! INSIDE OR OUTSIDE PLAY: Each of our cushioned, durable, slip-resistant foam stepping stones can be used during outdoor birthday parties or indoor sleepovers. DETAILS: Complete with 25 colored foam “safety stones”, 27 challenge cards, game spinner, and instructions, each board game allows 2-6 players. For children ages 5 years old and up.",https://www.amazon.com/Original-Floor-Lava-Endless-Games/dp/B07DGYX438/ref=sr_1_46?dib=eyJ2IjoiMSJ9.ujuvvKH99aPISQw_8cqXAooZEYFWRPdGDNrF3hbsvcUsWNefZtOLxJcNJs0OtYyAt4R0cB6bmGzcV7TGkxq86CH5yc9ckFg3maa_xeAh9qsm2kn1oX-GwxJpLzEov-F-zdYff0oe_OofyV3_CgKGHfhh1Wsm_Qxwy7Io9LqIrL7c2c6HdZkg_q7i-C7ohCdCIWKTK3OI7FY1vE_noWSld4nIdjwFr7SexIUASdKhbFlcCBIzp1-JHpfuOHpTtj3zidbicrN0OXRpr-mlcdxnEyAJKVFHUiUoQZDULiNJW7g.kZLlG7WVy4f0j25UhSbXLbVsWawg9IHUkIdpnaPYZ3Q&dib_tag=se&keywords=toys+and+games&qid=1746191219&sr=8-46
B001CJVTLC,Pokemon Assorted Lot of 50 Single Cards [Any Series],Toys_and_Games,5.52,9.75,43.4,4.3,73236,"YOUR BEST VALUEPOKEMON CARDS: Lookfurther for the best dealsassorted Pokemon cards. LOTSRANDOM CARDS FROM ALL SERIES: You will receive a varietyregular and energy cards. Duplicates may occur. BOOST YOUR COLLECTION: With random cards from every series, each lota surprise. Get a great assortmentcards",https://www.amazon.com/Pokemon-742818061742-ASSORTED-POKEMON-CARDS/dp/B001CJVTLC/ref=sr_1_47?dib=eyJ2IjoiMSJ9.ujuvvKH99aPISQw_8cqXAooZEYFWRPdGDNrF3hbsvcUsWNefZtOLxJcNJs0OtYyAt4R0cB6bmGzcV7TGkxq86CH5yc9ckFg3maa_xeAh9qsm2kn1oX-GwxJpLzEov-F-zdYff0oe_OofyV3_CgKGHfhh1Wsm_Qxwy7Io9LqIrL7c2c6HdZkg_q7i-C7ohCdCIWKTK3OI7FY1vE_noWSld4nIdjwFr7SexIUASdKhbFlcCBIzp1-JHpfuOHpTtj3zidbicrN0OXRpr-mlcdxnEyAJKVFHUiUoQZDULiNJW7g.kZLlG7WVy4f0j25UhSbXLbVsWawg9IHUkIdpnaPYZ3Q&dib_tag=se&keywords=toys+and+games&qid=1746191219&sr=8-47
B0CSFBGQJP,"hahaland Toddler Toys Montessori Toys for 1 Year Old Boy Girl Birthday Gift, 10 in 1 Cloth Fishing Game with Stacking Cups- Number Counting, Color Sorting, Shape Learning 1 Year Old Girl Boy Gifts",Toys_and_Games,26.99,36.99,27.0,4.7,1034,"Montessori-Inspired Fishing Set: With 22 Pcs, including a fishing pole, 15 pcs fish, 5 pcs stackable fish buckets, and an ocean mat that doubles as a storage bag, it encourages toddler’s natural curiosity, hands-on learning, active exploration and promote skill development. Introduce your little one to their first fishing adventure with our soft, toddler-friendly cloth fishing toys Keep Toddlers Entertained & Develop Cognition: Catch fish of various colors, count your catches, and sort them by color or number. These activities build early math and cognitive skills in a playful way. Our stackable fish buckets add extra fun, allowing toddlers to explore size differentiation, spatial awareness. it immerses toddlers in a realistic fishing experience, enhances imaginative play and provides sensory stimulation Strong Stickiness for Easy Fishing: Using Velcro and felt instead of magnets to fishing, it offers a safe, tactile, and engaging play experience for toddlers. Toddlers can simply touch the felt fish with Velcro hook, and the fish will adhere to it, provide them with a greater sense of achievement and encourages continued & active engagement. Planting the seeds of curiosity for a lifetime of baby exploration Safe to Explore with All Senses: Safest in Tiny Hands, Overpick Fishing Toy, Where Safety Bites First! Baby Toys 12-18 months need to be soft. The fishing rod, fish, and mat is made of soft and gentle felt and fabric materials, making them safe for toddlers to handle. They don't have sharp edges or small parts that could pose a choking hazard, ensuring a safe play experience. They are machine washable, make it convenient for parents Convenience & Portability: Combining the ocean mat with a storage bag makes cleanup and storage a breeze. After playtime, simply gather up the mat, along with all the fishing toys, and easily store them in the bag. Taking the fun on playdates or outings, everything you need is conveniently packed in one place. It is a travel toys for toddlers 1-3. Whether it's birthday or Christmas, this fabric fishing game promises to be a hit, offering both learning and fun in a single package Quality Is Our First Priority：Choose the Original Quality for Your Baby's Safety.Not all lookalikes are created equal—only the original ensures safety, softness, and trusted materials for your little one",https://www.amazon.com/Montessori-Birthday-Toddlers-Stacking-Counting/dp/B0CSFBGQJP/ref=sr_1_48?dib=eyJ2IjoiMSJ9.ujuvvKH99aPISQw_8cqXAooZEYFWRPdGDNrF3hbsvcUsWNefZtOLxJcNJs0OtYyAt4R0cB6bmGzcV7TGkxq86CH5yc9ckFg3maa_xeAh9qsm2kn1oX-GwxJpLzEov-F-zdYff0oe_OofyV3_CgKGHfhh1Wsm_Qxwy7Io9LqIrL7c2c6HdZkg_q7i-C7ohCdCIWKTK3OI7FY1vE_noWSld4nIdjwFr7SexIUASdKhbFlcCBIzp1-JHpfuOHpTtj3zidbicrN0OXRpr-mlcdxnEyAJKVFHUiUoQZDULiNJW7g.kZLlG7WVy4f0j25UhSbXLbVsWawg9IHUkIdpnaPYZ3Q&dib_tag=se&keywords=toys+and+games&qid=1746191219&sr=8-48
B09JDMZ8X4,"Hasbro Gaming Bop It Extreme Electronic Game for 1 or More Players, Fun Party Interactive Game for Kids Ages 8+, 4 Modes Including One-On-One Mode (Amazon Exclusive)",Toys_and_Games,27.96,,,4.6,2274,"RAPID-FIRE GAMEPLAY: It's the ultimate action-reaction challenge . The Bop It . Extreme electronic game features 4 different modes of play: Solo, Pass It, Party, and One-on-One Challenges 2-PLAYER GAME: The Bop It . Extreme game lets players experience a 2-player rapid-fire gaming experience as 2 opponents hold the unit and go head-to-head at the same time INTERACTIVE GAME: With knobs, a wheel, and a lever on the game unit, responding to the commands really keep players on their toes . Bop It . Twist It . Pull It . Spin It . Flick It . FUN GAME FOR PARTIES: Bring the game to parties and get ready for some fast-paced, over-the-top excitement . In Party mode, players use their whole body to play FUN GAME FOR KIDS AGES 8 plus: This portable game makes a great birthday gift or holiday gift for both boys and girls ages 8 and up. Take it out for a family game night, and pack it away for vacation fun",https://www.amazon.com/Hasbro-Gaming-BOP-IT-Extreme/dp/B09JDMZ8X4/ref=sr_1_49?dib=eyJ2IjoiMSJ9.ujuvvKH99aPISQw_8cqXAooZEYFWRPdGDNrF3hbsvcUsWNefZtOLxJcNJs0OtYyAt4R0cB6bmGzcV7TGkxq86CH5yc9ckFg3maa_xeAh9qsm2kn1oX-GwxJpLzEov-F-zdYff0oe_OofyV3_CgKGHfhh1Wsm_Qxwy7Io9LqIrL7c2c6HdZkg_q7i-C7ohCdCIWKTK3OI7FY1vE_noWSld4nIdjwFr7SexIUASdKhbFlcCBIzp1-JHpfuOHpTtj3zidbicrN0OXRpr-mlcdxnEyAJKVFHUiUoQZDULiNJW7g.kZLlG7WVy4f0j25UhSbXLbVsWawg9IHUkIdpnaPYZ3Q&dib_tag=se&keywords=toys+and+games&qid=1746191219&sr=8-49
